{
  "type": "aos.comparative_brand_audit",
  "schema_version": "2026-05-comparative-brand-audit-v0",
  "id": "comparative-brand-audit:symphony-talent-phenom-radancy",
  "audit_id": "audit:employer-brand-comparative-audit-fixture",
  "scope": {
    "framework": "KILOS",
    "evidence_scope": "local_fixture_company_brand_audits",
    "company_audit_scope": "local_fixture_browser_evidence",
    "registry_path": "browser-evidence/registry.json",
    "local_fixture_evidence_only": true,
    "live_websites": false,
    "report_generation": false,
    "notes": "Comparative synthesis derived only from the three local Company Brand Audit fixtures and their Browser Evidence request IDs."
  },
  "companies": [
    {
      "name": "Symphony Talent",
      "role": "client",
      "company_audit_id": "company-brand-audit:symphony-talent"
    },
    {
      "name": "Phenom",
      "role": "competitor",
      "company_audit_id": "company-brand-audit:phenom"
    },
    {
      "name": "Radancy",
      "role": "competitor",
      "company_audit_id": "company-brand-audit:radancy"
    }
  ],
  "source_company_audits": [
    {
      "id": "company-brand-audit:symphony-talent",
      "company": "Symphony Talent",
      "role": "client",
      "path": "company-audits/symphony-talent.json",
      "request_ids": [
        "symphony_talent_careers_site_planning"
      ]
    },
    {
      "id": "company-brand-audit:phenom",
      "company": "Phenom",
      "role": "competitor",
      "path": "company-audits/phenom.json",
      "request_ids": [
        "phenom_careers_site_planning"
      ]
    },
    {
      "id": "company-brand-audit:radancy",
      "company": "Radancy",
      "role": "competitor",
      "path": "company-audits/radancy.json",
      "request_ids": [
        "radancy_careers_site_planning"
      ]
    }
  ],
  "comparative_synthesis": {
    "summary": "Across the local fixture audits, the shared market frame is talent-experience work with different proof centers: Symphony Talent emphasizes craft, impact, technology, and client partnership; Phenom emphasizes intelligent personalization, product pace, customer outcomes, and builder culture; Radancy emphasizes enterprise hiring scale, global reach, established client programs, and specialist recruitment marketing expertise.",
    "company_audit_ids": [
      "company-brand-audit:symphony-talent",
      "company-brand-audit:phenom",
      "company-brand-audit:radancy"
    ],
    "request_ids": [
      "symphony_talent_careers_site_planning",
      "phenom_careers_site_planning",
      "radancy_careers_site_planning"
    ]
  },
  "shared_themes": [
    {
      "theme": "Talent experience impact",
      "summary": "All three fixtures connect employee work to improving hiring or talent experiences, but they differ in whether the proof is framed as craft and relevance, product personalization, or enterprise reach.",
      "company_audit_ids": [
        "company-brand-audit:symphony-talent",
        "company-brand-audit:phenom",
        "company-brand-audit:radancy"
      ],
      "request_ids": [
        "symphony_talent_careers_site_planning",
        "phenom_careers_site_planning",
        "radancy_careers_site_planning"
      ]
    },
    {
      "theme": "Professional expertise as the employer promise",
      "summary": "Symphony Talent and Radancy explicitly lean on professional craft or specialist expertise, while Phenom translates expertise into product building and intelligent experience creation.",
      "company_audit_ids": [
        "company-brand-audit:symphony-talent",
        "company-brand-audit:phenom",
        "company-brand-audit:radancy"
      ],
      "request_ids": [
        "symphony_talent_careers_site_planning",
        "phenom_careers_site_planning",
        "radancy_careers_site_planning"
      ]
    },
    {
      "theme": "Proof gaps in the local slice",
      "summary": "The three company audits all record missing review-site, benefits, employee voice, and concrete career mobility evidence, so the comparative read should stay limited to fixture-level positioning rather than market-current claims.",
      "company_audit_ids": [
        "company-brand-audit:symphony-talent",
        "company-brand-audit:phenom",
        "company-brand-audit:radancy"
      ],
      "request_ids": [
        "symphony_talent_careers_site_planning",
        "phenom_careers_site_planning",
        "radancy_careers_site_planning"
      ]
    }
  ],
  "key_differentiators": [
    {
      "company": "Symphony Talent",
      "summary": "The strongest client differentiator in the local evidence is the combination of creative storytelling, recruitment marketing technology, craft, and client partnership in one employer promise.",
      "company_audit_ids": [
        "company-brand-audit:symphony-talent"
      ],
      "request_ids": [
        "symphony_talent_careers_site_planning"
      ]
    },
    {
      "company": "Phenom",
      "summary": "Phenom is differentiated by a product-led personalization story that positions employees as builders of intelligent talent moments tied to customer outcomes.",
      "company_audit_ids": [
        "company-brand-audit:phenom"
      ],
      "request_ids": [
        "phenom_careers_site_planning"
      ]
    },
    {
      "company": "Radancy",
      "summary": "Radancy is differentiated by status proof: enterprise hiring programs, global reach, established client work, and specialist recruitment marketing expertise.",
      "company_audit_ids": [
        "company-brand-audit:radancy"
      ],
      "request_ids": [
        "radancy_careers_site_planning"
      ]
    }
  ],
  "whitespace_opportunities": [
    {
      "opportunity": "Own the human relevance layer between creative craft and recruitment technology.",
      "rationale": "Symphony Talent can use future evidence to make its craft-and-impact promise more concrete against Phenom's product-personalization story and Radancy's scale-and-reputation proof.",
      "company_audit_ids": [
        "company-brand-audit:symphony-talent",
        "company-brand-audit:phenom",
        "company-brand-audit:radancy"
      ],
      "request_ids": [
        "symphony_talent_careers_site_planning",
        "phenom_careers_site_planning",
        "radancy_careers_site_planning"
      ]
    },
    {
      "opportunity": "Add proof of employee voice, career growth, benefits, and review sentiment before drawing stronger recommendations.",
      "rationale": "Each source company audit flags unavailable review-site evidence and limited fixture scope, leaving lifestyle, sentiment, and concrete mobility proof underdeveloped across the set.",
      "company_audit_ids": [
        "company-brand-audit:symphony-talent",
        "company-brand-audit:phenom",
        "company-brand-audit:radancy"
      ],
      "request_ids": [
        "symphony_talent_careers_site_planning",
        "phenom_careers_site_planning",
        "radancy_careers_site_planning"
      ]
    }
  ],
  "kilos_positioning_matrix": [
    {
      "dimension": "impact",
      "client_read": "Symphony Talent frames impact as helping employers reach candidates with more relevant talent experiences through craft, technology, and partnership.",
      "competitor_reads": [
        {
          "company": "Phenom",
          "read": "Phenom frames impact as making every talent moment more personal through intelligent product work and customer outcomes.",
          "company_audit_id": "company-brand-audit:phenom",
          "request_ids": [
            "phenom_careers_site_planning"
          ]
        },
        {
          "company": "Radancy",
          "read": "Radancy's local evidence is less impact-led and more focused on enterprise scale and expertise.",
          "company_audit_id": "company-brand-audit:radancy",
          "request_ids": [
            "radancy_careers_site_planning"
          ]
        }
      ],
      "synthesis": "Impact is a shared category, but Symphony Talent and Phenom carry clearer impact narratives in this fixture slice.",
      "company_audit_ids": [
        "company-brand-audit:symphony-talent",
        "company-brand-audit:phenom",
        "company-brand-audit:radancy"
      ],
      "request_ids": [
        "symphony_talent_careers_site_planning",
        "phenom_careers_site_planning",
        "radancy_careers_site_planning"
      ]
    },
    {
      "dimension": "opportunity",
      "client_read": "Symphony Talent signals opportunity through craft, recruitment marketing technology, and client partnership as expertise-building contexts.",
      "competitor_reads": [
        {
          "company": "Phenom",
          "read": "Phenom implies opportunity through builder culture and intelligent product work, but the fixture does not prove specific mobility paths.",
          "company_audit_id": "company-brand-audit:phenom",
          "request_ids": [
            "phenom_careers_site_planning"
          ]
        },
        {
          "company": "Radancy",
          "read": "Radancy signals opportunity through specialist recruitment marketing expertise and enterprise program exposure.",
          "company_audit_id": "company-brand-audit:radancy",
          "request_ids": [
            "radancy_careers_site_planning"
          ]
        }
      ],
      "synthesis": "Opportunity is present as expertise and exposure, but none of the local fixtures prove concrete career progression or internal mobility.",
      "company_audit_ids": [
        "company-brand-audit:symphony-talent",
        "company-brand-audit:phenom",
        "company-brand-audit:radancy"
      ],
      "request_ids": [
        "symphony_talent_careers_site_planning",
        "phenom_careers_site_planning",
        "radancy_careers_site_planning"
      ]
    },
    {
      "dimension": "kinship",
      "client_read": "Symphony Talent's local fixture is collaborative in tone but does not provide employee community, belonging, or voice proof.",